{
  "$schema": "./schemas/project-config.schema.json",
  "schemaVersion": 1,
  "project": {
    "name": "example-saas",
    "description": "A generated full-stack web product",
    "profile": "fullstack-web"
  },
  "surfaces": ["api", "webapp", "website"],
  "modules": ["shared-contracts", "observability", "database-postgres", "transactional-email", "rate-limit-valkey", "auth-session", "e2e-playwright"],
  "adapters": ["github-ci"],
  "verification": {
    "required": true
  }
}
